J,"Mildenberger, M; Leiserowitz, A",,,,"Mildenberger, Matto; Leiserowitz, Anthony",,,Public opinion on climate change: Is there an economy-environment tradeoff?,ENVIRONMENTAL POLITICS,,,English,Article,,,,,,Climate change; public opinion; economy-environment tradeoff,LOCAL WEATHER; PERCEPTIONS; SUPPORT; ATTITUDES; VALUES; POLICY,"Does the state of the economy condition public concern for the environment? Scholars have long argued that environmental preferences decline during economic downturns as individuals prioritize short-term economic needs over longer-term environmental concerns. Yet, this assumption has rarely been subjected to rigorous empirical scrutiny at the individual level. The presumed link between economic and environmental preferences is revisited, using the first individual-level opinion panel (n=1043) of US climate attitudes, incorporating both self-reported and objective economic data. In contrast with prior studies that emphasize the role of economic downturns in driving environmental preference shifts, using a stronger identification strategy, there is little evidence that changes in either individual economic fortunes or local economic conditions are associated with decreased belief that climate change is happening or reduced prioritization of climate policy action. Instead, the evidence suggests that climate belief declines are associated with shifting political cues. These findings have important implications for understanding the dynamics of political conflict over environmental policy globally.","[Mildenberger, Matto] Univ Calif Santa Barbara, Dept Polit Sci, Santa Barbara, CA 93106 USA; [Leiserowitz, Anthony] Yale Univ, Sch Forestry & Environm Studies, New Haven, CT 06511 USA",University of California System; University of California Santa Barbara; Yale University,"Mildenberger, M (corresponding author), Univ Calif Santa Barbara, Dept Polit Sci, Santa Barbara, CA 93106 USA.",mildenberger@polsci.ucsb.edu,"Leiserowitz, Anthony/HGB-4208-2022; Leiserowitz, Anthony/ABE-6529-2020","Leiserowitz, Anthony/0000-0001-5349-409X; Leiserowitz, Anthony/0000-0001-5349-409X; Mildenberger, Matto/0000-0001-5784-435X",Surdna Foundation; 11th Hour Project; Grantham Foundation for the Protection of the Environment,"Surdna Foundation; 11th Hour Project(Ministry of Education, China - 111 Project); Grantham Foundation for the Protection of the Environment","Funding support for this research came from the Surdna Foundation, the 11th Hour Project, and the Grantham Foundation for the Protection of the Environment.",,53,73,81,10,54,"ROUTLEDGE JOURNALS, TAYLOR & FRANCIS LTD",ABINGDON,"2-4 PARK SQUARE, MILTON PARK, ABINGDON OX14 4RN, OXON, ENGLAND",0964-4016,1743-8934,,ENVIRON POLIT,Environ. Polit.,,2017,26,5,,,,,801,824,,10.1080/09644016.2017.1322275,http://dx.doi.org/10.1080/09644016.2017.1322275,,,24,Environmental Studies; Political Science,Social Science Citation Index (SSCI),Environmental Sciences & Ecology; Government & Law,FA6NR,,,,,2024-06-17,WOS:000405561000001,View Full Record in Web of Science,1,2,Yale Project on Climate Change Communication
J,"Mildenberger, M; Howe, P; Lachapelle, E; Stokes, L; Marlon, J; Gravelle, T",,,,"Mildenberger, Matto; Howe, Peter; Lachapelle, Erick; Stokes, Leah; Marlon, Jennifer; Gravelle, Timothy",,,The Distribution of Climate Change Public Opinion in Canada,PLOS ONE,,,English,Article,,,,,,,NONRESPONSE; SEA,"While climate scientists have developed high resolution data sets on the distribution of climate risks, we still lack comparable data on the local distribution of public climate change opinions. This paper provides the first effort to estimate local climate and energy opinion variability outside the United States. Using a multi-level regression and post-stratification (MRP) approach, we estimate opinion in federal electoral districts and provinces. We demonstrate that a majority of the Canadian public consistently believes that climate change is happening. Belief in climate change's causes varies geographically, with more people attributing it to human activity in urban as opposed to rural areas. Most prominently, we find majority support for carbon cap and trade policy in every province and district. By contrast, support for carbon taxation is more heterogeneous. Compared to the distribution of US climate opinions, Canadians believe climate change is happening at higher levels. This new opinion data set will support climate policy analysis and climate policy decision making at national, provincial and local levels.","[Mildenberger, Matto; Stokes, Leah] Univ Calif Santa Barbara, Dept Polit Sci, Santa Barbara, CA 93106 USA; [Howe, Peter] Utah State Univ, Dept Environm & Soc, Logan, UT 84322 USA; [Lachapelle, Erick] Univ Montreal, Dept Polit Sci, Montreal, PQ, Canada; [Marlon, Jennifer] Yale Univ, Sch Forestry & Environm Studies, New Haven, CT USA; [Gravelle, Timothy] Univ Essex, Dept Govt, Essex, England",University of California System; University of California Santa Barbara; Utah System of Higher Education; Utah State University; Universite de Montreal; Yale University; University of Essex,"Mildenberger, M (corresponding author), Univ Calif Santa Barbara, Dept Polit Sci, Santa Barbara, CA 93106 USA.",mildenberger@polsci.ucsb.edu,"Gravelle, Timothy B./I-3077-2019; Lachapelle, Erick/AAI-1449-2021","Gravelle, Timothy B./0000-0002-7091-206X; Marlon, Jennifer/0000-0002-8299-9609; Howe, Peter/0000-0002-1555-3746; Mildenberger, Matto/0000-0001-5784-435X",Social Sciences and Humanities Research Council of Canada [410-2011-2765]; Fonds de Recherche du Quebec - Societe et Culture [2012-NP-162717]; Skoll Global Threats Fund; Energy Foundation; Grantham Foundation for the Protection of the Environment; Ministere des Relations internationales et de la francophonie; Chaire d'etudes politiques et economiques americaines; l'Institut de l'energie Trottier; Sustainable Prosperity; Public Policy Forum; University of California Santa Barbara (UCSB),Social Sciences and Humanities Research Council of Canada(Social Sciences and Humanities Research Council of Canada (SSHRC)); Fonds de Recherche du Quebec - Societe et Culture; Skoll Global Threats Fund; Energy Foundation; Grantham Foundation for the Protection of the Environment; Ministere des Relations internationales et de la francophonie; Chaire d'etudes politiques et economiques americaines; l'Institut de l'energie Trottier; Sustainable Prosperity; Public Policy Forum; University of California Santa Barbara (UCSB)(University of California System),"This research was supported by funding from the Social Sciences and Humanities Research Council of Canada (grant number 410-2011-2765, EL, http://www.sshrc-crsh.gc.ca/home-accueil-eng.aspx), the Fonds de Recherche du Quebec - Societe et Culture (grant number 2012-NP-162717, EL, http://www.frqsc.gouv.qc.ca/), the Skoll Global Threats Fund (JM, http://www.skollglobalthreats.org/), the Energy Foundation (JM, http://www.ef.org/), and the Grantham Foundation for the Protection of the Environment (JM, http://www.granthamfoundation.org/). Additionally, funding for individual survey waves was previously provided by the Ministere des Relations internationales et de la francophonie (http://www.mrif.gouv.qc.ca/en/), the Chaire d'etudes politiques et economiques americaines (http:l//cerium.umontreal.ca/recherche/unites-de-recherche/chairedetudes-politiques-et-economiques-americainescepea/), l'Institut de l'energie Trottier (http://www.polymtl.ca/iet/en/), Sustainable Prosperity (http://www.sustainableprosperity.ca/), Canada 2020 (http://canada2020.ca/), and the Public Policy Forum (http://www.ppforum.ca/). The costs of publishing this article as an open-access publication were covered by the University of California Santa Barbara (UCSB) Open Access Fund (http://www.library.ucsb.edu/scholarlycommunication/ucsb-open-access-fund).; Thanks to Christopher Borick, Barry Rabe, and Anthony Leiserowitz for their support of this project, and the collection of its underlying data. Thanks to the Social Sciences and Humanities Research Council of Canada, the Fonds de Recherche du Quebec-Societe et Culture, the Skoll Global Threats Fund, the Energy Foundation, and the Grantham Foundation for the Protection of the Environment for financial support. Funding for individual survey waves was provided by the Ministere des Relations internationales et de la Francophonie, the Public Policy Forum, Sustainable Prosperity, Canada 2020, l'Institut de l'energie Trottier and la Chaire d'etudes politiques et economiques americaines.",,31,65,71,1,24,PUBLIC LIBRARY SCIENCE,SAN FRANCISCO,"1160 BATTERY STREET, STE 100, SAN FRANCISCO, CA 94111 USA",1932-6203,,,PLOS ONE,PLoS One,AUG 3,2016,11,8,,,,,,,e0159774,10.1371/journal.pone.0159774,http://dx.doi.org/10.1371/journal.pone.0159774,,,14,Multidisciplinary Sciences,Science Citation Index Expanded (SCI-EXPANDED); Social Science Citation Index (SSCI),Science & Technology - Other Topics,DT3GA,27486659,"Green Published, gold",,,2024-06-17,WOS:000381367800038,View Full Record in Web of Science,1,4,CSEE
J,"Bird, DK; Haynes, K; van den Honert, R; McAneney, J; Poortinga, W",,,,"Bird, Deanne K.; Haynes, Katharine; van den Honert, Rob; McAneney, John; Poortinga, Wouter",,,Nuclear power in Australia: A comparative analysis of public opinion regarding climate change and the Fukushima disaster,ENERGY POLICY,,,English,Article,,,,,,Climate change; Public attitudes; Energy futures,RISK; GENDER; PERCEPTIONS; TARGETS,"A nation-wide survey was conducted in 2010 to investigate the Australian public's attitudes to nuclear power in relation to climate change and in comparison to other energy alternatives. The survey showed a majority of respondents (42%) willing to accept nuclear power if it would help tackle climate change. Following the disaster at the Fukushima Daiichi Nuclear Power Complex in Japan, an event triggered by the 11 March 2011 Tohoku earthquake and tsunami, it was expected that support for nuclear power in Australia would change. In light of this, a follow-up survey was conducted in 2012. Indeed, the post-Fukushima results show a majority of respondents (40%) were not willing to accept nuclear power as an option to help tackle climate change, despite the fact that most Australians still believed nuclear power to offer a cleaner, more efficient option than coal, which currently dominates the domestic production of energy. Expanding the use of renewable energy sources (71%) remains the most popular option, followed by energy-efficient technologies (58%) and behavioural change (54%). Opposition to nuclear power will continue to be an obstacle against its future development even when posed as a viable solution to climate change. (C) 2013 The Authors. Published by Elsevier Ltd. All rights reserved.","[Bird, Deanne K.; Haynes, Katharine; van den Honert, Rob; McAneney, John] Macquarie Univ, N Ryde, NSW 2109, Australia; [Poortinga, Wouter] Cardiff Univ, Welsh Sch Architecture, Cardiff CF10 3AX, S Glam, Wales",Macquarie University; Cardiff University,"Bird, DK (corresponding author), Macquarie Univ, N Ryde, NSW 2109, Australia.",deanne.bird@gmail.com; haynes.katharine@gmail.com; rob.vandenhonert@mq.edu.au; john.mcaneney@mq.edu.au; PoortingaW@cardiff.ac.uk,"; Bird, Deanne/G-7130-2015; Poortinga, Wouter/A-1802-2010","Haynes, Katharine/0000-0002-1024-6878; Bird, Deanne/0000-0001-8556-0987; Poortinga, Wouter/0000-0002-6926-8545",,,,,61,85,87,0,69,ELSEVIER SCI LTD,OXFORD,"THE BOULEVARD, LANGFORD LANE, KIDLINGTON, OXFORD OX5 1GB, OXON, ENGLAND",0301-4215,1873-6777,,ENERG POLICY,Energy Policy,FEB,2014,65,,,,,,644,653,,10.1016/j.enpol.2013.09.047,http://dx.doi.org/10.1016/j.enpol.2013.09.047,,,10,Economics; Energy & Fuels; Environmental Sciences; Environmental Studies,Science Citation Index Expanded (SCI-EXPANDED); Social Science Citation Index (SSCI),Business & Economics; Energy & Fuels; Environmental Sciences & Ecology,AA0UV,,hybrid,,,2024-06-17,WOS:000330813800063,View Full Record in Web of Science,1,2,custom
J,"de Blasio, E; Sorice, M",,,,"de Blasio, Emiliana; Sorice, Michele",,,The framing of climate change in Italian politics and its impact on public opinion,INTERNATIONAL JOURNAL OF MEDIA & CULTURAL POLITICS,,,English,Article,,,,,,climate change; Italian politics; public policies; parties frame analysis; political discourse,,"The article examines the issue of climate change and its importance to Italian politics. In particular, the authors analyse whether political parties and their leaders give due importance to the issues in their party literature and speeches. In order to investigate this phenomenon, the authors studied manifestos of those political parties represented in Parliament between 2008 and 2013, other official documents available on their websites and official statements of political leaders. The overall picture emerging is a substantial lack of attention paid to climate change, which is also poorly represented in the Italian media. One of the key problems, however, lies in what we define as the 'global' dimension of the climate change debate that makes it look unattractive to local political discourse (where Italian politics is traditionally rooted). We argue this impacts negatively on public opinion and the lack of Italian public policies aimed at ensuring sustainability and promoting good behaviour and environmental best practice.","[de Blasio, Emiliana] LUISS Univ, New Media Studies & Gender Polit, Rome, Italy; [Sorice, Michele] LUISS Univ, Polit Commun, Rome, Italy",Luiss Guido Carli University; Luiss Guido Carli University,"de Blasio, E (corresponding author), LUISS Guido Carli, Ctr Media & Commun Studies Massimo Baldini, Via Romania 32, I-00197 Rome, RM, Italy.",edeblasio@luiss.it; msorice@luiss.it,"Sorice, Michele/J-8752-2019","Sorice, Michele/0000-0003-3731-5690; De Blasio, Emiliana/0000-0002-1505-9713",,,,,23,9,9,0,0,INTELLECT LTD,BRISTOL,"THE MILL, PARNALL RD, BRISTOL, BS16 3JG, ENGLAND",1740-8296,2040-0918,,INT J MEDIA CULT POL,Int. J. Media Cult. Polit.,MAR 1,2013,9,1,,,,,59,69,,10.1386/macp.9.1.59_1,http://dx.doi.org/10.1386/macp.9.1.59_1,,,11,Communication,Emerging Sources Citation Index (ESCI),Communication,V9R9H,,,,,2024-06-17,WOS:000422468800005,View Full Record in Web of Science,0,1,parliamentary debates
J,"Clements, B",,,,"Clements, Ben",,,Exploring public opinion on the issue of climate change in Britain,BRITISH POLITICS,,,English,Article,,,,,,public opinion; climate change; environmental concern; Britain; survey analysis,RISK PERCEPTIONS; ENVIRONMENT; KNOWLEDGE; VIEWS; POLITICIZATION; ATTITUDES; POLITICS; BELIEFS; GENDER; BASES,"Addressing the effects of climate change constitutes a complex and pressing public policy challenge requiring action at the national and international levels. Securing public support for initiatives in this area is an important aim for policymakers and civil society actors concerned with the environment and sustainability. Although opinion polls and surveys consistently show proportions of the British population with sceptical views, little scholarly investigation has been undertaken into public opinion on climate change in Britain. This research note examines which factors affect citizens' awareness of and attitudes towards climate change. It undertakes multivariate analysis of nationally representative surveys to examine the social and attitudinal correlates of climate change attitudes. Accounting for sociological background, both political-ideological attitudes and general environmental orientations have strong effects. There is a clear gap in attitudes between men and women and strong evidence of differences by level of education. Climate change scepticism is associated with factors such as being male, less well educated, supporting the Conservatives and having right-wing ideological beliefs. The findings should encourage future research on the issue of climate change in British politics. British Politics (2012) 7, 183-202. doi:10.1057/bp.2012.1; published online 12 March 2012","Univ Leicester, Dept Polit & Int Relat, Leicester LE1 7RH, Leics, England",University of Leicester,"Clements, B (corresponding author), Univ Leicester, Dept Polit & Int Relat, Leicester LE1 7RH, Leics, England.",,,"Clements, Ben/0000-0002-1024-2543",,,,,51,43,47,5,84,PALGRAVE MACMILLAN LTD,BASINGSTOKE,"BRUNEL RD BLDG, HOUNDMILLS, BASINGSTOKE RG21 6XS, HANTS, ENGLAND",1746-918X,1746-9198,,BRIT POLIT,Br. Polit.,JUN,2012,7,2,,,,,183,202,,10.1057/bp.2012.1,http://dx.doi.org/10.1057/bp.2012.1,,,20,Political Science,Social Science Citation Index (SSCI),Government & Law,941GT,,,,,2024-06-17,WOS:000303952400006,View Full Record in Web of Science,1,1,EB; DEFRA; BSA
J,"Pietsch, J; McAllister, I",,,,"Pietsch, Juliet; McAllister, Ian",,,'A diabolical challenge': public opinion and climate change policy in Australia,ENVIRONMENTAL POLITICS,,,English,Article,,,,,,public opinion; ANUpoll; climate change; environmental protection policy; emissions trading scheme,UNITED-STATES; RISK; VALUES; ENVIRONMENTALISM; COMMUNICATION; PERCEPTIONS,"The need for co-ordinated international action to mitigate climate change makes it one of the most complex public policy problems of modern times. For the advanced democracies, public opinion is a key element in developing an appropriate policy response. Australian public opinion towards climate change and the public policies that have been proposed to deal with the problem, most notably the emissions trading scheme (ETS), are examined using national survey data collected in late 2008. The results show widespread public concern about climate change, and a majority of respondents support the introduction of an ETS. However, a significant minority of the public remains opposed. Most importantly, however, most people declare themselves willing to pay more for environmental protection.","[Pietsch, Juliet] Deakin Univ, Sch Int & Polit Studies, Melbourne, Vic, Australia; [McAllister, Ian] Australian Natl Univ, Res Sch Biol Sci, Canberra, ACT 2601, Australia",Deakin University; Australian National University,"Pietsch, J (corresponding author), Deakin Univ, Sch Int & Polit Studies, Melbourne, Vic, Australia.",juliet.pietsch@deakin.edu.au,,"Pietsch, Juliet/0000-0002-8330-184X",,,,,53,55,61,6,43,"ROUTLEDGE JOURNALS, TAYLOR & FRANCIS LTD",ABINGDON,"2-4 PARK SQUARE, MILTON PARK, ABINGDON OX14 4RN, OXON, ENGLAND",0964-4016,1743-8934,,ENVIRON POLIT,Environ. Polit.,,2010,19,2,,,,,217,236,,10.1080/09644010903574509,http://dx.doi.org/10.1080/09644010903574509,,,20,Environmental Studies; Political Science,Social Science Citation Index (SSCI),Environmental Sciences & Ecology; Government & Law,575WW,,,,,2024-06-17,WOS:000276101800003,View Full Record in Web of Science,1,1,ANUpoll on the Environment
J,"Bromley-Trujillo, R; Poe, J",,,,"Bromley-Trujillo, Rebecca; Poe, John",,,The importance of salience: public opinion and state policy action on climate change,JOURNAL OF PUBLIC POLICY,,,English,Article,,,,,,climate change; issue salience; public policy; state politics,RENEWABLE PORTFOLIO STANDARDS; AMERICAN STATES; GOVERNMENT IDEOLOGY; MEASURING CITIZEN; PEOPLE KNOW; DIFFUSION; INNOVATION; ENERGY; POLITICS; ABORTION,"How does the salience of environmental issues influence climate policy adoption in the American states? This article considers how two aspects of public salience, issue problem status and issue attention, work with environmental interest group membership to influence climate policy adoption in the American states. We contribute to the theoretical development of issue salience and offer alternative measures that capture differences in salience across subnational units. We find evidence that states where climate change is perceived to be a problem, and where attention to environmental issues is high, are more likely to adopt relevant policies. Furthermore, states with Republican majorities in either legislative chamber are less likely to adopt climate policies. Our findings have implications for the impact of salience on the policy process.","[Bromley-Trujillo, Rebecca] Christopher Newport Univ, Dept Polit Sci, Newport News, VA 23606 USA; [Poe, John] Univ Kentucky, Dept Hlth Management & Policy, Lexington, KY 40506 USA",University of Kentucky,"Bromley-Trujillo, R (corresponding author), Christopher Newport Univ, Dept Polit Sci, Newport News, VA 23606 USA.",rebecca.bromleytrujillo@cnu.edu,"Bromley-Trujillo, Rebecca/AAN-5155-2020",,,,,,80,65,76,5,48,CAMBRIDGE UNIV PRESS,CAMBRIDGE,"EDINBURGH BLDG, SHAFTESBURY RD, CB2 8RU CAMBRIDGE, ENGLAND",0143-814X,1469-7815,,J PUBLIC POLICY,J. Public Policy,JUN,2020,40,2,,,,,280,304,PII S0143814X18000375,10.1017/S0143814X18000375,http://dx.doi.org/10.1017/S0143814X18000375,,,25,Political Science; Public Administration,Social Science Citation Index (SSCI),Government & Law; Public Administration,MW3AP,,,,,2024-06-17,WOS:000556914600007,View Full Record in Web of Science,1,6,Pew; others
J,"Marquart-Pyatt, ST; Shwom, RL; Dietz, T; Dunlap, RE; Kaplowitz, SA; McCright, AM; Zahran, S",,,,"Marquart-Pyatt, Sandra T.; Shwom, Rachael L.; Dietz, Thomas; Dunlap, Riley E.; Kaplowitz, Stan A.; McCright, Aaron M.; Zahran, Sammy",,,UNDERSTANDING PUBLIC Opinion on Climate Change: A Call for Research,ENVIRONMENT,,,English,Editorial Material,,,,,,,UNITED-STATES; POLICY; PERCEPTIONS; ENVIRONMENT; POLITICS; SCIENCE; VIEWS; VULNERABILITY; KNOWLEDGE; BELIEFS,,"[Marquart-Pyatt, Sandra T.; Dietz, Thomas; Kaplowitz, Stan A.; McCright, Aaron M.] Michigan State Univ, Dept Sociol, E Lansing, MI 48824 USA; [Shwom, Rachael L.] Rutgers State Univ, Dept Human Ecol, Piscataway, NJ 08855 USA; [Dunlap, Riley E.] Oklahoma State Univ, Dept Sociol, Stillwater, OK 74078 USA; [Zahran, Sammy] Colorado State Univ, Dept Econ, Ft Collins, CO 80523 USA",Michigan State University; Rutgers University System; Rutgers University New Brunswick; Oklahoma State University System; Oklahoma State University - Stillwater; Colorado State University,"Marquart-Pyatt, ST (corresponding author), Michigan State Univ, Dept Sociol, E Lansing, MI 48824 USA.",,"Dunlap, Riley E./Z-1676-2019; McCright, Aaron Matthew/Z-1967-2019","Dunlap, Riley E./0000-0002-7047-3757; Shwom, Rachael/0000-0002-9648-1659",,,,,50,45,54,0,56,"ROUTLEDGE JOURNALS, TAYLOR & FRANCIS LTD",ABINGDON,"4 PARK SQUARE, MILTON PARK, ABINGDON OX14 4RN, OXFORDSHIRE, ENGLAND",0013-9157,,,ENVIRONMENT,Environment,JUL-AUG,2011,53,4,,,,,38,42,,10.1080/00139157.2011.588555,http://dx.doi.org/10.1080/00139157.2011.588555,,,5,Environmental Sciences; Environmental Studies,Science Citation Index Expanded (SCI-EXPANDED); Social Science Citation Index (SSCI),Environmental Sciences & Ecology,823WQ,,,,,2024-06-17,WOS:000295158400006,View Full Record in Web of Science,1,11,Gallup
J,"Egan, PJ; Konisky, DM; Mullin, M",,,,"Egan, Patrick J.; Konisky, David M.; Mullin, Megan",,,Ascendant Public Opinion The Rising Influence of Climate Change on Americans' Attitudes about the Environment,PUBLIC OPINION QUARTERLY,,,English,Article,,,,,,,AFFORDABLE CARE ACT; POLITICS; FEEDBACK; ISSUES,"Here we document an under-studied but important phenomenon that we call ascendant public opinion, which emerges when a new concern is framed as an instance of a broader issue and gains ascendancy over that issue in the public's mind. We focus on the ever-increasing role climate change has come to play over the past three decades in shaping how Americans think about broader environmental concerns. We show that news coverage of the environment has focused increasingly on climate change over time, while climate change concurrently has come to dominate all other environmental problems in the strength of its association with general environmental concern in opinion surveys. Panel studies provide evidence that the growing correlation between attitudes on climate change and the environment is predominantly due to the impact of the former on the latter. These developments have been consequential: we estimate that Americans' level of concern about the environment is now both more elevated and more polarized along party lines than if climate change did not occupy its dominant place on the environmental agenda. Climate change is likely just one example of how ascendant public opinion can have important consequences for politics and policy.","[Egan, Patrick J.] NYU, Polit & Publ Policy, New York, NY 10012 USA; [Konisky, David M.] Indiana Univ, Publ & Environm Affairs, Bloomington, IN USA; [Mullin, Megan] Duke Univ, Environm Polit, Durham, NC USA",New York University; Indiana University System; Indiana University Bloomington; Duke University,"Egan, PJ (corresponding author), NYU, Wilf Family Dept Polit, 19 W 4th St, New York, NY 10012 USA.",patrick.egan@nyu.edu,"Konisky, David/S-2618-2019","Konisky, David/0000-0002-1146-3938; Mullin, Megan/0000-0002-1936-802X",,,,,37,13,13,1,17,OXFORD UNIV PRESS,OXFORD,"GREAT CLARENDON ST, OXFORD OX2 6DP, ENGLAND",0033-362X,1537-5331,,PUBLIC OPIN QUART,Public Opin. Q.,MAR 18,2022,86,1,,,,,134,148,,10.1093/poq/nfab071,http://dx.doi.org/10.1093/poq/nfab071,,FEB 2022,15,"Communication; Political Science; Social Sciences, Interdisciplinary",Social Science Citation Index (SSCI),Communication; Government & Law; Social Sciences - Other Topics,ZY4UZ,,,,,2024-06-17,WOS:000757498700001,View Full Record in Web of Science,1,18,Gallup
