J,"Nagel, J",,,,"Nagel, Joane",,,"CLIMATE CHANGE, PUBLIC OPINION, AND THE MILITARY SECURITY COMPLEX",SOCIOLOGICAL QUARTERLY,,,English,Article,,,,,,,,,"Univ Kansas, Lawrence, KS 66045 USA",University of Kansas,"Nagel, J (corresponding author), Univ Kansas, 1415 Jayhawk Blvd, Lawrence, KS 66045 USA.",nagel@ku.edu,,,,,,,17,12,16,0,10,TAYLOR & FRANCIS INC,PHILADELPHIA,"530 WALNUT STREET, STE 850, PHILADELPHIA, PA 19106 USA",0038-0253,1533-8525,,SOCIOL QUART,Sociol. Q.,SPR,2011,52,2,,,,,203,210,,10.1111/j.1533-8525.2011.01200.x,http://dx.doi.org/10.1111/j.1533-8525.2011.01200.x,,,8,Sociology,Social Science Citation Index (SSCI),Sociology,751TW,,,,,2024-06-17,WOS:000289641500003,View Full Record in Web of Science,57,1,WVS
J,"Li, N; Hilgard, J; Scheufele, DA; Winneg, KM; Jamieson, KH",,,,"Li, Nan; Hilgard, Joseph; Scheufele, Dietram A.; Winneg, Kenneth M.; Jamieson, Kathleen Hall",,,Cross-pressuring conservative Catholics? Effects of Pope Francis' encyclical on the US public opinion on climate change,CLIMATIC CHANGE,,,English,Article,,,,,,,CREDIBILITY; POLICY,"In an encyclical released in June of 2015, Pope Francis cast the need to address climate change as a moral imperative. Using nationally-representative surveys with supplemental samples of Catholics, we investigate changes in the U.S. public's post-encyclical attitudes about climate change and the Catholic pontiff. People who were aware of the encyclical held more polarized attitudes toward climate change than those who were unaware of it. Whereas encyclical-aware liberals expressed heightened concerns about climate change, encyclical-aware conservatives expressed lower levels. Cross-pressured by the inconsistency between the pontiff's views and those of their political allies, conservative Catholics devalued the Pope's credibility on climate change. These findings have important implications for communication about climate change in polarized opinion environments.","[Li, Nan] Texas Tech Univ, Dept Agr Educ & Commun, Lubbock, TX 79409 USA; [Hilgard, Joseph; Winneg, Kenneth M.; Jamieson, Kathleen Hall] Univ Penn, Annenberg Publ Policy Ctr, Philadelphia, PA 19104 USA; [Scheufele, Dietram A.] Univ Wisconsin Madison, Dept Life Sci Commun, Madison, WI 53706 USA; [Scheufele, Dietram A.] Morgridge Inst Res, Madison, WI 53706 USA","Texas Tech University System; Texas Tech University; University of Pennsylvania; University of Wisconsin System; University of Wisconsin Madison; University of Wisconsin System; University of Wisconsin Madison; The Morgridge Institute for Research, Inc.","Li, N (corresponding author), Texas Tech Univ, Dept Agr Educ & Commun, Lubbock, TX 79409 USA.",nan.li@ttu.edu,"Li, Nan/F-8553-2011; Li, Nan/AAA-8373-2022; Scheufele, Dietram A./A-8737-2008","Li, Nan/0000-0001-5942-552X; Scheufele, Dietram A./0000-0002-9914-5407",,,,,44,44,48,2,13,SPRINGER,DORDRECHT,"VAN GODEWIJCKSTRAAT 30, 3311 GZ DORDRECHT, NETHERLANDS",0165-0009,1573-1480,,CLIMATIC CHANGE,Clim. Change,DEC,2016,139,3-4,,,,,367,380,,10.1007/s10584-016-1821-z,http://dx.doi.org/10.1007/s10584-016-1821-z,,,14,Environmental Sciences; Meteorology & Atmospheric Sciences,Science Citation Index Expanded (SCI-EXPANDED); Social Science Citation Index (SSCI),Environmental Sciences & Ecology; Meteorology & Atmospheric Sciences,ED6JQ,,Green Submitted,,,2024-06-17,WOS:000388962300003,View Full Record in Web of Science,1,1,custom
J,"Howe, PD; Mildenberger, M; Marlon, JR; Leiserowitz, A",,,,"Howe, Peter D.; Mildenberger, Matto; Marlon, Jennifer R.; Leiserowitz, Anthony",,,Geographic variation in opinions on climate change at state and local scales in the USA,NATURE CLIMATE CHANGE,,,English,Article,,,,,,,PUBLIC-OPINION; PERSONAL-EXPERIENCE; POLICY PREFERENCES; RISK PERCEPTIONS; POLITICS; WEATHER; POSTSTRATIFICATION; WILLINGNESS; ATTITUDES; BELIEFS,"Addressing climate change in the United States requires enactment of national, state and local mitigation and adaptation policies. The success of these initiatives depends on public opinion, policy support and behaviours at appropriate scales. Public opinion, however, is typically measured with national surveys that obscure geographic variability across regions, states and localities. Here we present independently validated high-resolution opinion estimates using a multilevel regression and poststratification model. The model accurately predicts climate change beliefs, risk perceptions and policy preferences at the state, congressional district, metropolitan and county levels, using a concise set of demographic and geographic predictors. The analysis finds substantial variation in public opinion across the nation. Nationally, 63% of Americans believe global warming is happening, but county-level estimates range from 43 to 80%, leading to a diversity of political environments for climate policy. These estimates provide an important new source of information for policymakers, educators and scientists to more effectively address the challenges of climate change.","[Howe, Peter D.] Utah State Univ, Quinney Coll Nat Resources, Dept Environm & Soc, Logan, UT 84322 USA; [Mildenberger, Matto; Marlon, Jennifer R.; Leiserowitz, Anthony] Yale Univ, Sch Forestry & Environm Studies, New Haven, CT 06511 USA",Utah System of Higher Education; Utah State University; Yale University,"Howe, PD (corresponding author), Utah State Univ, Quinney Coll Nat Resources, Dept Environm & Soc, Logan, UT 84322 USA.",peter.howe@usu.edu,"Leiserowitz, Anthony/HGB-4208-2022; Leiserowitz, Anthony/ABE-6529-2020","Leiserowitz, Anthony/0000-0001-5349-409X; Leiserowitz, Anthony/0000-0001-5349-409X; Mildenberger, Matto/0000-0001-5784-435X; Howe, Peter/0000-0002-1555-3746; Marlon, Jennifer/0000-0002-8299-9609",Skoll Global Threats fund; Energy Foundation; 11th Hour Project; Grantham Foundation for the Protection of the Environment; V. K. Rasmussen Foundation,"Skoll Global Threats fund; Energy Foundation; 11th Hour Project(Ministry of Education, China - 111 Project); Grantham Foundation for the Protection of the Environment; V. K. Rasmussen Foundation","This project was supported by the Skoll Global Threats fund, the Energy Foundation, the 11th Hour Project, the Grantham Foundation for the Protection of the Environment, and the V. K. Rasmussen Foundation. The authors wish to thank E. Maibach, C. R-Renouf, G. Feinberg, L. Fernandez, S. Rosenthal and B. Schwarz.",,43,369,450,11,143,NATURE RESEARCH,BERLIN,"HEIDELBERGER PLATZ 3, BERLIN, 14197, GERMANY",1758-678X,1758-6798,,NAT CLIM CHANGE,Nat. Clim. Chang.,JUN,2015,5,6,,,,,596,603,,10.1038/nclimate2583,http://dx.doi.org/10.1038/nclimate2583,,,8,Environmental Sciences; Environmental Studies; Meteorology & Atmospheric Sciences,Science Citation Index Expanded (SCI-EXPANDED); Social Science Citation Index (SSCI),Environmental Sciences & Ecology; Meteorology & Atmospheric Sciences,CL2YR,,Green Submitted,Y,N,2024-06-17,WOS:000356814800039,View Full Record in Web of Science,1,6,Yale Project on Climate Change Communication
J,"Lorenzoni, I; Pidgeon, NF",,,,"Lorenzoni, Irene; Pidgeon, Nick F.",,,Public views on climate change: European and USA perspectives,CLIMATIC CHANGE,,,English,Article; Proceedings Paper,Workshop on Global Warming - The Psychology of Long Term Risk,"NOV 12, 2004","Princeton Univ, Princeton, NJ","Cooperat Inst Climate Sci,Program Sci, Technol & Environm Policy",Princeton Univ,,RISK PERCEPTION; PERCEIVED RISK; UNITED-STATES; TRUST; ATTITUDES; SCIENCE; UK,"If uncontrolled, human influences on the climate system may generate changes that will endanger various aspects of life on Earth. The precise implications of the scientific claims about climate change, and the extent to which they pose dangers to various populations, are becoming intensely debated at many levels in relation to policy. How `danger' is interpreted will ultimately affect which actions are taken. In this paper, we examine how climate change is conceptualised by publics in Europe and in the USA. Although there is widespread concern about climate change, it is of secondary importance in comparison to other issues in people's daily lives. Most individuals relate to climate change through personal experience, knowledge, the balance of benefits and costs, and trust in other societal actors. We analyse these factors through findings from various surveys and studies, which highlight both the distinctiveness and some shared perspectives at a generalised level. We reflect upon these in relation to trust and responsibility for climate change action, and risk communication, supporting the call for discourses about climate change to also be situated in people's locality, as a means of increasing its saliency.","Univ E Anglia, Ctr Environm Risk, Norwich NR4 7TJ, Norfolk, England; Univ E Anglia, Tyndall Ctr Climate Change Res, Zuckerman Inst Connect Environm Res, Sch Environm Sci, Norwich NR4 7TJ, Norfolk, England",University of East Anglia; University of East Anglia,"Pidgeon, NF (corresponding author), Univ E Anglia, Ctr Environm Risk, Norwich NR4 7TJ, Norfolk, England.",i.lorenzoni@uea.ac.uk; PidgeonN@cardiff.ac.uk,,,,,,,67,662,777,6,203,SPRINGER,DORDRECHT,"VAN GODEWIJCKSTRAAT 30, 3311 GZ DORDRECHT, NETHERLANDS",0165-0009,1573-1480,,CLIMATIC CHANGE,Clim. Change,JUL,2006,77,1-2,,,,,73,95,,10.1007/s10584-006-9072-z,http://dx.doi.org/10.1007/s10584-006-9072-z,,,23,Environmental Sciences; Meteorology & Atmospheric Sciences,Science Citation Index Expanded (SCI-EXPANDED); Social Science Citation Index (SSCI); Conference Proceedings Citation Index - Science (CPCI-S),Environmental Sciences & Ecology; Meteorology & Atmospheric Sciences,076KN,,,,,2024-06-17,WOS:000239956800004,View Full Record in Web of Science,25,1,Eurobarometer
J,"Leviston, Z; Walker, I; Morwinski, S",,,,"Leviston, Z.; Walker, I.; Morwinski, S.",,,Your opinion on climate change might not be as common as you think,NATURE CLIMATE CHANGE,,,English,Article,,,,,,,FALSE-CONSENSUS; PLURALISTIC IGNORANCE; MEDIA REPRESENTATIONS; UNITED-STATES; SCIENCE; POLARIZATION; PERCEPTION; BIAS; CUES,"Political and media debate on the existence and causes of climate change has become increasingly factious in several western countries, often resting on claims and counter-claims about what most citizens really think. There are several well-established phenomena in psychology about how people perceive the prevalence of opinions, including the false consensus effect(1) (a tendency to overestimate how common one's 'own' opinion is) and pluralistic ignorance(2) (where most people privately reject an opinion, but assume incorrectly that most others accept it). We investigated these biases in people's opinions about the existence and causes of climate change. In two surveys conducted 12 months apart in Australia (n = 5,036; n = 5,030), respondents were asked their own opinion about the nature of climate change, and then asked to estimate levels of opinion among the general population. We demonstrate that opinions about climate change are subject to strong false consensus effects, that people grossly overestimate the numbers of people who reject the existence of climate change in the broader community, and that people with high false consensus bias are less likely to change their opinions.","[Leviston, Z.; Walker, I.] CSIRO, Ecosyst Sci, Perth, WA 6913, Australia; [Morwinski, S.] Tech Univ Dresden, D-01062 Dresden, Germany",Commonwealth Scientific & Industrial Research Organisation (CSIRO); Technische Universitat Dresden,"Leviston, Z (corresponding author), CSIRO, Ecosyst Sci, Perth, WA 6913, Australia.",zoe.leviston@csiro.au,"Leviston, Zoe/G-5460-2010; Walker, Iain/G-5457-2010","Leviston, Zoe/0000-0002-4969-7916; Walker, Iain/0000-0002-1020-5873",CSIRO,CSIRO(Commonwealth Scientific & Industrial Research Organisation (CSIRO)),Research for this paper was financially supported by the CSIRO's Climate Adaptation Flagship.,,29,120,131,3,61,NATURE PUBLISHING GROUP,LONDON,"MACMILLAN BUILDING, 4 CRINAN ST, LONDON N1 9XW, ENGLAND",1758-678X,,,NAT CLIM CHANGE,Nat. Clim. Chang.,APR,2013,3,4,,,,,334,337,,10.1038/NCLIMATE1743,http://dx.doi.org/10.1038/NCLIMATE1743,,,4,Environmental Sciences; Environmental Studies; Meteorology & Atmospheric Sciences,Science Citation Index Expanded (SCI-EXPANDED); Social Science Citation Index (SSCI),Environmental Sciences & Ecology; Meteorology & Atmospheric Sciences,150OL,,,,,2024-06-17,WOS:000319400400010,View Full Record in Web of Science,1,2,custom
J,"Kilburn, HW",,,,"Kilburn, H. Whitt",,,Religion and foundations of American public opinion towards global climate change,ENVIRONMENTAL POLITICS,,,English,Article,,,,,,American religion; global climate change; global warming; American public opinion,ENVIRONMENTAL CONCERN; KNOWLEDGE; ATTITUDES; THESIS,"The religious foundations of American opinion towards climate change are analysed by means of a panel survey of voting-age citizens, interviewed in February and October 2008. It shows that religion's influence is multifaceted. Biblically literalist beliefs and to a lesser extent attendance at religious services, but not nominal religious affiliations, led Americans to view climate change as mostly natural and to express less concern over its consequences. Yet evangelical Protestants reporting frequent service attendance were distinctively more concerned about the effects of climate change.","Grand Valley State Univ, Dept Polit Sci, Allendale, MI 49401 USA",Grand Valley State University,"Kilburn, HW (corresponding author), Grand Valley State Univ, Dept Polit Sci, Allendale, MI 49401 USA.",kilburnw@mail.gvsu.edu,,,,,,,40,42,50,3,57,"ROUTLEDGE JOURNALS, TAYLOR & FRANCIS LTD",ABINGDON,"4 PARK SQUARE, MILTON PARK, ABINGDON OX14 4RN, OXFORDSHIRE, ENGLAND",0964-4016,1743-8934,,ENVIRON POLIT,Environ. Polit.,4-May,2014,23,3,,,,,473,489,,10.1080/09644016.2013.859777,http://dx.doi.org/10.1080/09644016.2013.859777,,,17,Environmental Studies; Political Science,Social Science Citation Index (SSCI),Environmental Sciences & Ecology; Government & Law,AF4DJ,,,,,2024-06-17,WOS:000334661300007,View Full Record in Web of Science,1,1,ANES