Publication Type,Authors,Book Authors,Book Editors,Book Group Authors,Author Full Names,Book Author Full Names,Group Authors,Article Title,Source Title,Book Series Title,Book Series Subtitle,Language,Document Type,Conference Title,Conference Date,Conference Location,Conference Sponsor,Conference Host,Author Keywords,Keywords Plus,Abstract,Addresses,Affiliations,Reprint Addresses,Email Addresses,Researcher Ids,ORCIDs,Funding Orgs,Funding Name Preferred,Funding Text,Cited References,Cited Reference Count,"Times Cited, WoS Core","Times Cited, All Databases",180 Day Usage Count,Since 2013 Usage Count,Publisher,Publisher City,Publisher Address,ISSN,eISSN,ISBN,Journal Abbreviation,Journal ISO Abbreviation,Publication Date,Publication Year,Volume,Issue,Part Number,Supplement,Special Issue,Meeting Abstract,Start Page,End Page,Article Number,DOI,DOI Link,Book DOI,Early Access Date,Number of Pages,WoS Categories,Web of Science Index,Research Areas,IDS Number,Pubmed Id,Open Access Designations,Highly Cited Status,Hot Paper Status,Date of Export,UT (Unique WOS ID),Web of Science Record,k,t,survey
J,"Marlon, JR; Wang, XR; Bergquist, P; Howe, PD; Leiserowitz, A; Maibach, E; Mildenberger, M; Rosenthal, S",,,,"Marlon, Jennifer R.; Wang, Xinran; Bergquist, Parrish; Howe, Peter D.; Leiserowitz, Anthony; Maibach, Edward; Mildenberger, Matto; Rosenthal, Seth",,,Change in US state-level public opinion about climate change: 2008-2020,ENVIRONMENTAL RESEARCH LETTERS,,,English,Article,,,,,,US; state-level public opinion; climate change; risk perceptions; climate policy; multilevel regression and poststratification,POLITICAL POLARIZATION; PSYCHOLOGICAL BARRIERS; PERCEPTIONS; SUPPORT; WEATHER,"Public attitudes toward climate change influence climate and energy policies and guide individualmitigation and adaptation behaviors. Over the last decade, as scientific certainty about the causesand impacts of, and solutions to the climate crisis has increased, cities, states, and regions in theUnited States have pursued diverse policy strategies. Yet, our understanding of how Americans'climate views are changing remains largely limited to national trends. Here we use a large USsurvey dataset (N=27075) to estimate dynamic, state-level changes in 16 climate change beliefs,risk perceptions, and policy preferences over 13 years (2008-2020). We find increases in globalwarming issueimportance and perceived harm in every state. Policysupport, however, increased inmore liberal states like California and New York, but remained stable elsewhere. Year-by-yearestimates of state-level climate opinions can be used to support sub-national mitigation andadaptation efforts that depend on public support and engagement.","[Marlon, Jennifer R.; Wang, Xinran; Leiserowitz, Anthony; Rosenthal, Seth] Yale Univ, Sch Environm, New Haven, CT 06520 USA; [Bergquist, Parrish] Georgetown Univ, McCourt Sch Publ Policy, Washington, DC USA; [Howe, Peter D.] Utah State Univ, Dept Environm & Soc, Logan, UT USA; [Maibach, Edward] George Mason Univ, Ctr Climate Change Commun, Fairfax, VA USA; [Mildenberger, Matto] Univ Calif Santa Barbara, Dept Polit Sci, Santa Barbara, CA USA",Yale University; Georgetown University; Utah System of Higher Education; Utah State University; George Mason University; University of California System; University of California Santa Barbara,"Marlon, JR (corresponding author), Yale Univ, Sch Environm, New Haven, CT 06520 USA.",jennifer.marlon@yale.edu,"Leiserowitz, Anthony/HGB-4208-2022; Maibach, Edward/A-7102-2009","Leiserowitz, Anthony/0000-0001-5349-409X; Maibach, Edward/0000-0003-3409-9187; Wang, Xinran/0000-0002-9937-4162; Mildenberger, Matto/0000-0001-5784-435X",11th Hour Project; Energy Foundation; Grantham Foundation; MacArthur Foundation,"11th Hour Project(Ministry of Education, China - 111 Project); Energy Foundation; Grantham Foundation; MacArthur Foundation","This project was supported by the 11th Hour Project, the Energy Foundation, the Grantham Foundation, and the MacArthur Foundation.",,69,16,19,12,30,IOP Publishing Ltd,BRISTOL,"TEMPLE CIRCUS, TEMPLE WAY, BRISTOL BS1 6BE, ENGLAND",1748-9326,,,ENVIRON RES LETT,Environ. Res. Lett.,DEC 1,2022,17,12,,,,,,,124046,10.1088/1748-9326/aca702,http://dx.doi.org/10.1088/1748-9326/aca702,,,18,Environmental Sciences; Meteorology & Atmospheric Sciences,Science Citation Index Expanded (SCI-EXPANDED),Environmental Sciences & Ecology; Meteorology & Atmospheric Sciences,7A1OB,,gold,,,2024-06-17,WOS:000898232300001,View Full Record in Web of Science,1,12,Yale Project on Climate Change Communication
J,"Crawley, S; Coffé, H; Chapman, R",,,,"Crawley, Sam; Coffe, Hilde; Chapman, Ralph",,,Climate Belief and Issue Salience: Comparing Two Dimensions of Public Opinion on Climate Change in the EU,SOCIAL INDICATORS RESEARCH,,,English,Article,,,,,,Climate change; Public opinion; Issue salience; Cross-country; Eurobarometer,MULTILEVEL ANALYSIS; CHANGE PERCEPTIONS; RISK PERCEPTION; DETERMINANTS; SKEPTICISM; IDEOLOGY; VIEWS; ADAPTATION; AWARENESS; POLITICS,"Cross-country research on public opinion on climate change has mostly focused on people's beliefs about whether climate change is happening or is a serious problem, with little attention paid to other opinion dimensions such as issue salience. Relying on Eurobarometer data from 28 EU member states, we systematically compare the public's belief in and salience of climate change, examining variation across the EU using Bayesian multilevel analysis. We find high levels of belief but low levels of salience in most countries. Salience varies substantially between countries and is positively related to country wealth. Levels of greenhouse gas emissions appear to have a negative relationship with both belief and salience, and individuals' political orientation has more influence on climate opinion (particularly salience) in richer countries than in poorer countries. Overall, our findings suggest that belief and salience are distinct dimensions, and that country context influences salience more than belief.","[Crawley, Sam] Victoria Univ Wellington, Polit Sci & Int Relat Program, POB 600, Wellington 6140, New Zealand; [Coffe, Hilde] Univ Bath, Dept Polit Languages & Int Studies, Bath BA2 7AY, Avon, England; [Chapman, Ralph] Victoria Univ Wellington, Sch Geog Environm & Earth Sci, POB 600, Wellington 6140, New Zealand",Victoria University Wellington; University of Bath; Victoria University Wellington,"Crawley, S (corresponding author), Victoria Univ Wellington, Polit Sci & Int Relat Program, POB 600, Wellington 6140, New Zealand.",sam.crawley@vuw.ac.nz; H.R.Coffe@bath.ac.uk; ralph.chapman@vuw.ac.nz,,"Crawley, Sam/0000-0002-7847-0411",,,,,58,5,5,3,20,SPRINGER,DORDRECHT,"VAN GODEWIJCKSTRAAT 30, 3311 GZ DORDRECHT, NETHERLANDS",0303-8300,1573-0921,,SOC INDIC RES,Soc. Indic. Res.,JUL,2022,162,1,,,,,307,325,,10.1007/s11205-021-02842-0,http://dx.doi.org/10.1007/s11205-021-02842-0,,NOV 2021,19,"Social Sciences, Interdisciplinary; Sociology",Social Science Citation Index (SSCI),Social Sciences - Other Topics; Sociology,2E4VF,,,,,2024-06-17,WOS:000717368700001,View Full Record in Web of Science,1,1,custom
J,"Bayes, R; Bolsen, T; Druckman, JN",,,,"Bayes, Robin; Bolsen, Toby; Druckman, James N.",,,A Research Agenda for Climate Change Communication and Public Opinion: The Role of Scientific Consensus Messaging and Beyond,ENVIRONMENTAL COMMUNICATION-A JOURNAL OF NATURE AND CULTURE,,,English,Review,,,,,,Climate change; scientific consensus messaging; public opinion,GATEWAY BELIEF MODEL; AMERICAN STATES; SOCIAL NORMS; SCIENCE; POLARIZATION; PERCEPTIONS; POLITICS; POLITICIZATION; SUPPORT; IMPACT,"That climate change has been accelerated by human activity is supported by a near-universal consensus of climate scientists. In this paper, we review many of the studies that have been done on the impact of communicating the scientific consensus to the general public. We discuss ongoing debates about these studies, but more importantly, we highlight complementary areas that we believe should define future research. We emphasize how a focus on processing motivations, context, and message variations may help resolve some of the debates about when scientific consensus messaging works. We then discuss ways to expand this research agenda by examining support for a broader range of outcomes across a wider range of populations, particularly those most vulnerable to the immediate impacts of climate change. Our goal is to provide a blueprint for expanding the work on climate change communication for scientific consensus messaging and beyond.","[Bayes, Robin; Druckman, James N.] Northwestern Univ, Dept Polit Sci, Evanston, IL USA; [Bolsen, Toby] Georgia State Univ, Dept Polit Sci, 38 Peachtree Ctr Ave,Suite 1005, Atlanta, GA 30303 USA",Northwestern University; University System of Georgia; Georgia State University,"Bolsen, T (corresponding author), Georgia State Univ, Dept Polit Sci, 38 Peachtree Ctr Ave,Suite 1005, Atlanta, GA 30303 USA.",tbolsen@gsu.edu,"Bayes, Robin/JBS-1288-2023","Bayes, Robin/0000-0002-8795-8451",,,,,139,28,31,9,10,"ROUTLEDGE JOURNALS, TAYLOR & FRANCIS LTD",ABINGDON,"2-4 PARK SQUARE, MILTON PARK, ABINGDON OX14 4RN, OXON, ENGLAND",1752-4032,1752-4040,,ENVIRON COMMUN,Environ. Commun.,JAN 2,2023,17,1,,,,,16,34,,10.1080/17524032.2020.1805343,http://dx.doi.org/10.1080/17524032.2020.1805343,,SEP 2020,19,Communication; Environmental Studies,Social Science Citation Index (SSCI),Communication; Environmental Sciences & Ecology,9F0MS,,,,,2024-06-17,WOS:000566632000001,View Full Record in Web of Science,0,,review
J,"Crawley, S; Coffé, H; Chapman, R",,,,"Crawley, Sam; Coffe, Hilde; Chapman, Ralph",,,"Public opinion on climate change: Belief and concern, issue salience and support for government action",BRITISH JOURNAL OF POLITICS & INTERNATIONAL RELATIONS,,,English,Article,,,,,,climate change; issue salience; public opinion; United Kingdom,CHANGE PERCEPTIONS; ATTITUDES; SKEPTICISM; IMPACT; POLICY; UK; DETERMINANTS; ORIENTATION; ADAPTATION; DOMINANCE,"Climate policy across the developed world remains inadequate, despite high levels of concern about climate change among the public. Yet public opinion on climate change is complex, with individuals differing on three key opinion dimensions: belief and concern, issue salience, and support for government action. In this study, we investigate how these dimensions intersect at the individual level. Based on data from an online survey conducted in 2018 in the United Kingdom (N = 787), a latent class analysis reveals that there are five climate change opinion publics. The two largest publics have strong beliefs that climate change is occurring, but view it as a low salience issue, or are wary of government action to address it. We also investigate sociopolitical covariates of each public. By providing a detailed picture of climate change views, these findings can help us to better understand the relationship between public opinion and climate policy.","[Crawley, Sam] Victoria Univ Wellington, Polit Sci & Int Relat Program, POB 600, Wellington 6140, New Zealand; [Coffe, Hilde] Univ Bath, Dept Polit Languages & Int Studies, Bath, Avon, England; [Chapman, Ralph] Victoria Univ Wellington, Sch Geog Environm & Earth Sci, Wellington, New Zealand",Victoria University Wellington; University of Bath; Victoria University Wellington,"Crawley, S (corresponding author), Victoria Univ Wellington, Polit Sci & Int Relat Program, POB 600, Wellington 6140, New Zealand.",sam.crawley@vuw.ac.nz,,"Crawley, Sam/0000-0002-7847-0411",Victoria University of Wellington [218266],Victoria University of Wellington,This work was supported by Victoria University of Wellington [grant number 218266].,,64,22,23,10,68,SAGE PUBLICATIONS INC,THOUSAND OAKS,"2455 TELLER RD, THOUSAND OAKS, CA 91320 USA",1369-1481,1467-856X,,BRIT J POLIT INT REL,Br. J. Polit. Int. Relat.,FEB,2020,22,1,,,,,102,121,1.36915E+15,10.1177/1369148119888827,http://dx.doi.org/10.1177/1369148119888827,,NOV 2019,20,International Relations; Political Science,Social Science Citation Index (SSCI),International Relations; Government & Law,KI9FA,,Green Accepted,,,2024-06-17,WOS:000496361400001,View Full Record in Web of Science,28,1,Eurobarometer
J,"Hamilton, LC; Hartter, J; Bell, E",,,,"Hamilton, Lawrence C.; Hartter, Joel; Bell, Erin",,,Generation gaps in US public opinion on renewable energy and climate change,PLOS ONE,,,English,Article,,,,,,,ENVIRONMENTAL CONCERN; PERCEPTIONS; VIEWS; ATTITUDES; ACCEPTANCE; BELIEFS; SCIENCE,"The topics of climate change and renewable energy are often linked in policy discussions and scientific analysis, but public opinion on these topics exhibits both overlap and divergence. Although renewable energy has potentially broader acceptance than anthropogenic climate change, it can also face differently-based opposition. Analyses of US and regional surveys, including time series of repeated surveys in New Hampshire (2010-2018) and northeast Oregon (2011-2018), explore the social bases and trends of public views on both issues. Political divisions are prominent, although somewhat greater regarding climate change due to substantive differences and more partisan opposition. Regarding climate change and to a lesser extent renewable energy, political divisions tends to widen with education. There also are robust age and temporal effects: younger adults more often prioritize renewable energy development, and agree with scientists on the reality of anthropogenic climate change (ACC). Across all age groups and both regional series, support for renewable energy and recognition of ACC have been gradually rising. Contrary to widespread speculation, these trends have not visibly responded to events such as the US hurricanes of 2012, 2017 or 2018. Together with age-cohort replacement and the potential for changes in age-group voting participation, however, the gradual trends suggest that public pressure for action on these issues could grow.","[Hamilton, Lawrence C.] Univ New Hampshire, Dept Sociol, Durham, NH 03824 USA; [Hartter, Joel] Univ Colorado, Environm Studies Program, Boulder, CO 80309 USA; [Bell, Erin] Univ New Hampshire, Civil & Environm Engn, Durham, NH 03824 USA",University System Of New Hampshire; University of New Hampshire; University of Colorado System; University of Colorado Boulder; University System Of New Hampshire; University of New Hampshire,"Hamilton, LC (corresponding author), Univ New Hampshire, Dept Sociol, Durham, NH 03824 USA.",Lawrence.Hamilton@unh.edu,,"Santini-Bell, Erin/0000-0002-9474-4937; Hamilton, Lawrence/0000-0003-1977-0649","National Science Foundation (The Living Bridge) [IIP-1230460, 1430260]; National Science Foundation (New Hampshire EPSCoR) [EPS-1101245]; Carsey School of Public Policy; Sustainability Institute at University of New Hampshire; Agricultural and Food Research Initiative, U.S. Department of Agriculture [2014-68002-21782, 2010-67023-21705]; Neil and Louise Tillotson Fund of the New Hampshire Charitable Foundation; National Science Foundation [DUE-1239783]; NIFA [2014-68002-21782, 580424, 687305, 2010-67023-21705] Funding Source: Federal RePORTER; Directorate For Engineering; Div Of Industrial Innovation & Partnersh [1430260] Funding Source: National Science Foundation","National Science Foundation (The Living Bridge); National Science Foundation (New Hampshire EPSCoR)(National Science Foundation (NSF)); Carsey School of Public Policy; Sustainability Institute at University of New Hampshire; Agricultural and Food Research Initiative, U.S. Department of Agriculture; Neil and Louise Tillotson Fund of the New Hampshire Charitable Foundation; National Science Foundation(National Science Foundation (NSF)); NIFA(United States Department of Agriculture (USDA)National Institute of Food and Agriculture); Directorate For Engineering; Div Of Industrial Innovation & Partnersh(National Science Foundation (NSF)NSF - Directorate for Engineering (ENG))","Renewable energy and climate questions on the Granite State Poll have been supported by grants from the National Science Foundation (The Living Bridge IIP-1230460 and 1430260 to EB and LCH; New Hampshire EPSCoR EPS-1101245 to LCH), and by the Carsey School of Public Policy and the Sustainability Institute at University of New Hampshire. The Communities and Forests in Oregon (CAFOR) project was supported by the Agricultural and Food Research Initiative, U.S. Department of Agriculture (2014-68002-21782 and 2010-67023-21705 to JH and LCH). The North Country survey was supported by a grant from the Neil and Louise Tillotson Fund of the New Hampshire Charitable Foundation to LCH. Support for the POLES surveys occurred through the PoLAR Partnership grant from the National Science Foundation (DUE-1239783). Any opinions, findings, and conclusions or recommendations expressed in this paper are those of the authors and do not necessarily reflect the views of supporting organizations. The funders had no role in study design, data collection and analysis, decision to publish, or preparation of the manuscript.; Renewable energy and climate questions on the Granite State Poll have been supported by grants from the National Science Foundation (The Living Bridge IIP-1230460 and 1430260; New Hampshire EPSCoR EPS-1101245), and by the Carsey School of Public Policy and the Sustainability Institute at University of New Hampshire. The Communities and Forests in Oregon (CAFOR) project was supported by the Agricultural and Food Research Initiative, U.S. Department of Agriculture (2014-68002-21782 and 2010-67023-21705). The North Country survey was supported by a grant from the Neil and Louise Tillotson Fund of the New Hampshire Charitable Foundation. Support for the POLES surveys occurred through the PoLAR Partnership grant from the National Science Foundation (DUE-1239783). Any opinions, findings, and conclusions or recommendations expressed in this paper are those of the authors and do not necessarily reflect the views of supporting organizations.",,44,37,40,2,23,PUBLIC LIBRARY SCIENCE,SAN FRANCISCO,"1160 BATTERY STREET, STE 100, SAN FRANCISCO, CA 94111 USA",1932-6203,,,PLOS ONE,PLoS One,JUL 10,2019,14,7,,,,,,,e0217608,10.1371/journal.pone.0217608,http://dx.doi.org/10.1371/journal.pone.0217608,,,20,Multidisciplinary Sciences,Science Citation Index Expanded (SCI-EXPANDED); Social Science Citation Index (SSCI),Science & Technology - Other Topics,IW4JZ,31291254,"gold, Green Published, Green Submitted",,,2024-06-17,WOS:000484947800014,View Full Record in Web of Science,1,9,custom
J,"Kardooni, R; Yusoff, SB; Kari, FB; Moeenizadeh, L",,,,"Kardooni, Roozbeh; Yusoff, Sumiani Binti; Kari, Fatimah Binti; Moeenizadeh, Leila",,,Public opinion on renewable energy technologies and climate change in Peninsular Malaysia,RENEWABLE ENERGY,,,English,Article,,,,,,Climate change; Renewable energy technology; Public opinion; Malaysian developing plan,SUSTAINABLE ENERGY; ENVIRONMENTAL BELIEFS; RISK PERCEPTION; POLICY; ATTITUDES; TRUST; ACCEPTANCE; DIFFUSION; MODEL,"The development of renewable energy policies is necessary to ensure secure and sustainable energy supplies at reasonable costs and to address issues related to global climate change. Since the year 2000 in Malaysia (time of the 8th Malaysian Plan), renewable energy has been included as a key fifth element in the country's fuel policy along with hydro, coal, gas, and oil, and a target of obtaining 5% of the total energy supply from renewable sources was set, although it has not yet been reached. This work explores public opinions regarding climate change and renewable energy in Peninsular Malaysia. Probability sampling and a stratified technique were used to conduct a survey with subjects aged 20 years and over with higher education qualifications. The results showed that the majority of Malaysians are concerned about climate change and have heard about renewable energy. However, only two out of five people in Peninsular Malaysia have used renewable energy products. This finding can be explained by the high price of renewable energy products, lack of knowledge about government policies, and ineffective programs and initiatives. (C) 2017 Elsevier Ltd. All rights reserved.","[Kardooni, Roozbeh] Univ Malaya, Inst Grad Studies, Kuala Lumpur 50603, Malaysia; [Yusoff, Sumiani Binti] Univ Malaya, Fac Engn, Dept Civil Engn, Kuala Lumpur 50603, Malaysia; [Kari, Fatimah Binti] Univ Malaya, Fac Econ & Adm, Dept Econ, Kuala Lumpur 50603, Malaysia; [Moeenizadeh, Leila] Univ Putra Malaysia, Environm Engn, Serdang, Malaysia",Universiti Malaya; Universiti Malaya; Universiti Malaya; Universiti Putra Malaysia,"Kardooni, R (corresponding author), Univ Malaya, Inst Grad Studies, Kuala Lumpur 50603, Malaysia.",r_kardooni@yahoo.com; sumiani@um.edu.my; fatimah_kari@um.edu.my; leia_moeenizadeh@yahoo.com,"YUSOFF, SUMIANI/B-9858-2010",,University of Malaya under the Postgraduate Research Grant (PPP) [PG010-2012B],University of Malaya under the Postgraduate Research Grant (PPP),The authors gratefully acknowledge the financial support from the University of Malaya under the Postgraduate Research Grant (PPP) no. PG010-2012B.,,51,93,94,2,63,PERGAMON-ELSEVIER SCIENCE LTD,OXFORD,"THE BOULEVARD, LANGFORD LANE, KIDLINGTON, OXFORD OX5 1GB, ENGLAND",0960-1481,1879-0682,,RENEW ENERG,Renew. Energy,FEB,2018,116,,A,,,,659,668,,10.1016/j.renene.2017.09.073,http://dx.doi.org/10.1016/j.renene.2017.09.073,,,10,Green & Sustainable Science & Technology; Energy & Fuels,Science Citation Index Expanded (SCI-EXPANDED); Social Science Citation Index (SSCI),Science & Technology - Other Topics; Energy & Fuels,FN7HB,,,,,2024-06-17,WOS:000416188200057,View Full Record in Web of Science,1,1,custom
J,"Benegal, SD",,,,"Benegal, Salil D.",,,The spillover of race and racial attitudes into public opinion about climate change,ENVIRONMENTAL POLITICS,,,English,Article,,,,,,Climate change; public opinion; race; racial resentment; polarization,POLITICS; US; POLARIZATION; OPPOSITION; IMPACT; POLICY; RACIALIZATION; RECESSION; WEATHER; WELFARE,"The relationship between racial attitudes and public opinion about climate change is examined. Public opinion data from Pew and American National Election Studies surveys are used to show that racial identification and prejudices are increasingly correlated with opinions about climate change during the Obama presidency. Results show that racial identification became a significant predictor of climate change concern following Obama's election in 2008, and that high levels of racial resentment are strongly correlated with reduced agreement with the scientific consensus on climate change. These results offer evidence for an effect termed the spillover of racialization. This helps further explain why the public remains so polarized on climate change, given the extent to which racial grievances and identities have become entangled with elite communication about climate change and its related policies today.","[Benegal, Salil D.] Depauw Univ, Dept Polit Sci, Greencastle, IN 46135 USA",DePauw University,"Benegal, SD (corresponding author), Depauw Univ, Dept Polit Sci, Greencastle, IN 46135 USA.",salilbenegal@depauw.edu,"Benegal, Salil/HTS-9099-2023","Benegal, Salil/0000-0001-7759-5725",,,,,53,44,55,3,26,"ROUTLEDGE JOURNALS, TAYLOR & FRANCIS LTD",ABINGDON,"2-4 PARK SQUARE, MILTON PARK, ABINGDON OX14 4RN, OXON, ENGLAND",0964-4016,1743-8934,,ENVIRON POLIT,Environ. Polit.,,2018,27,4,,,,,733,756,,10.1080/09644016.2018.1457287,http://dx.doi.org/10.1080/09644016.2018.1457287,,,24,Environmental Studies; Political Science,Social Science Citation Index (SSCI),Environmental Sciences & Ecology; Government & Law,GI5WQ,,,,,2024-06-17,WOS:000434441700009,View Full Record in Web of Science,1,8,Pew; ANES
